[
  {
    "id": "max_strength",
    "name": "Max Strength",
    "description": "Low-rep (1-5RM) compound loading with barbell or kettlebell targeting maximum force production and neuromuscular recruitment.",
    "recovery_cost": "high",
    "recovery_hours_min": 48,
    "session_position": "first",
    "compatible_in_session_with": ["mobility", "movement_skill"],
    "incompatible_in_session_with": ["anaerobic_intervals", "mixed_modal_conditioning", "aerobic_base"],
    "min_weekly_minutes": 60,
    "max_weekly_minutes": 270,
    "progression_model": "linear_load"
  },
  {
    "id": "strength_endurance",
    "name": "Strength Endurance",
    "description": "Higher-rep work under significant load — circuits, complexes, and density intervals that develop the capacity to sustain force output over time.",
    "recovery_cost": "high",
    "recovery_hours_min": 48,
    "session_position": "standalone",
    "compatible_in_session_with": ["mobility"],
    "incompatible_in_session_with": ["max_strength", "aerobic_base"],
    "min_weekly_minutes": 45,
    "max_weekly_minutes": 240,
    "progression_model": "density"
  },
  {
    "id": "relative_strength",
    "name": "Relative Strength",
    "description": "Strength expressed as a ratio of bodyweight — gymnastics, calisthenics, ring work, and weighted bodyweight movements demanding high skill alongside force production.",
    "recovery_cost": "medium",
    "recovery_hours_min": 24,
    "session_position": "first",
    "compatible_in_session_with": ["mobility", "movement_skill", "aerobic_base"],
    "incompatible_in_session_with": ["max_strength"],
    "min_weekly_minutes": 30,
    "max_weekly_minutes": 180,
    "progression_model": "volume_block"
  },
  {
    "id": "aerobic_base",
    "name": "Aerobic Base",
    "description": "Zone 1-2 steady-state work — running, rowing, cycling, hiking, or swimming at conversational pace — building the aerobic engine and fat oxidation capacity.",
    "recovery_cost": "low",
    "recovery_hours_min": 0,
    "session_position": "standalone",
    "compatible_in_session_with": ["mobility", "movement_skill", "relative_strength"],
    "incompatible_in_session_with": ["max_strength", "anaerobic_intervals", "strength_endurance"],
    "min_weekly_minutes": 90,
    "max_weekly_minutes": 600,
    "progression_model": "intensity_split_shift"
  },
  {
    "id": "anaerobic_intervals",
    "name": "Anaerobic Intervals",
    "description": "Short, maximal-effort intervals at Zone 4-5 — Tabata, 400m sprints, 30-sec all-out pieces — targeting VO2max and lactic capacity.",
    "recovery_cost": "high",
    "recovery_hours_min": 48,
    "session_position": "standalone",
    "compatible_in_session_with": ["mobility"],
    "incompatible_in_session_with": ["max_strength", "aerobic_base", "mixed_modal_conditioning"],
    "min_weekly_minutes": 20,
    "max_weekly_minutes": 90,
    "progression_model": "time_to_task"
  },
  {
    "id": "mixed_modal_conditioning",
    "name": "Mixed Modal Conditioning",
    "description": "Multiple movement types combined under time pressure — AMRAPs, chippers, GPP circuits, and barbell/KB complexes that tax systemic conditioning broadly.",
    "recovery_cost": "high",
    "recovery_hours_min": 48,
    "session_position": "standalone",
    "compatible_in_session_with": ["mobility"],
    "incompatible_in_session_with": ["max_strength", "anaerobic_intervals"],
    "min_weekly_minutes": 30,
    "max_weekly_minutes": 210,
    "progression_model": "density"
  },
  {
    "id": "power",
    "name": "Power / Explosiveness",
    "description": "Fast force production — Olympic lifts, kettlebell ballistics, plyometrics, and depth jumps where rate of force development is the primary training target.",
    "recovery_cost": "high",
    "recovery_hours_min": 48,
    "session_position": "first",
    "compatible_in_session_with": ["mobility", "max_strength"],
    "incompatible_in_session_with": ["anaerobic_intervals", "mixed_modal_conditioning", "strength_endurance"],
    "min_weekly_minutes": 20,
    "max_weekly_minutes": 120,
    "progression_model": "linear_load"
  },
  {
    "id": "mobility",
    "name": "Mobility / Tissue Prep",
    "description": "Joint health, range of motion development, and tissue preparation — loaded stretches, joint circles, fascial work, and active mobility drills.",
    "recovery_cost": "low",
    "recovery_hours_min": 0,
    "session_position": "any",
    "compatible_in_session_with": ["max_strength", "strength_endurance", "relative_strength", "aerobic_base", "anaerobic_intervals", "mixed_modal_conditioning", "power", "movement_skill", "durability", "combat_sport", "rehab"],
    "incompatible_in_session_with": [],
    "min_weekly_minutes": 30,
    "max_weekly_minutes": 120,
    "progression_model": "range_progression"
  },
  {
    "id": "movement_skill",
    "name": "Movement / Skill",
    "description": "Locomotion, coordination, pattern acquisition, and movement quality — tumbling, balance, crawling, flow sequences, and technical skill practice at sub-maximal intensity.",
    "recovery_cost": "medium",
    "recovery_hours_min": 24,
    "session_position": "any",
    "compatible_in_session_with": ["mobility", "aerobic_base", "relative_strength"],
    "incompatible_in_session_with": ["max_strength", "strength_endurance", "anaerobic_intervals"],
    "min_weekly_minutes": 20,
    "max_weekly_minutes": 180,
    "progression_model": "complexity"
  },
  {
    "id": "durability",
    "name": "Durability / Work Capacity",
    "description": "Loaded carries, rucking, sandbag work, and GPP circuits that build the capacity for sustained output under fatigue — the foundation of operational and expedition fitness.",
    "recovery_cost": "medium",
    "recovery_hours_min": 24,
    "session_position": "standalone",
    "compatible_in_session_with": ["mobility", "aerobic_base"],
    "incompatible_in_session_with": ["max_strength", "power"],
    "min_weekly_minutes": 45,
    "max_weekly_minutes": 300,
    "progression_model": "time_to_task"
  },
  {
    "id": "combat_sport",
    "name": "Combat Sport",
    "description": "BJJ drilling, positional sparring, grip conditioning, and isometric endurance work specific to grappling sports — mat time that has no substitute.",
    "recovery_cost": "high",
    "recovery_hours_min": 48,
    "session_position": "standalone",
    "compatible_in_session_with": ["mobility", "rehab"],
    "incompatible_in_session_with": ["max_strength", "anaerobic_intervals", "mixed_modal_conditioning"],
    "min_weekly_minutes": 60,
    "max_weekly_minutes": 420,
    "progression_model": "density"
  },
  {
    "id": "rehab",
    "name": "Rehab",
    "description": "Injury-specific therapeutic loading — isometrics, low-load progressive exercises, joint prep, and clinical protocols applied under injury or post-operative constraints.",
    "recovery_cost": "low",
    "recovery_hours_min": 0,
    "session_position": "any",
    "compatible_in_session_with": ["mobility", "aerobic_base", "combat_sport"],
    "incompatible_in_session_with": ["max_strength", "power", "anaerobic_intervals"],
    "min_weekly_minutes": 20,
    "max_weekly_minutes": 120,
    "progression_model": "range_progression"
  }
]
